content,keywords,title,category,writer_code,writer_name,writer_email
Exploring the beauty of the beaches at sunset.,"sunset, beach",Sunset Wonders,travel,P001,Ali Rezaei,ali.rezaei@example.com
A comprehensive guide to hiking the tallest mountains.,"hiking, mountain",Mountain Adventures,nature,P002,Sara Mohammadi,sara.mohammadi@example.com
Discovering the nightlife in bustling cities.,"night, city",City Life,urban,P003,Hossein Karimi,hossein.karimi@example.com
The wonders of the rainforest and its hidden waterfalls.,"waterfall, rainforest",Rainforest Secrets,nature,P002,Sara Mohammadi,sara.mohammadi@example.com
Surviving the harsh conditions of the desert.,"desert, sand",Desert Survival,travel,P001,Ali Rezaei,ali.rezaei@example.com
The calming effect of ocean waves.,"ocean, waves",Ocean Calm,nature,P004,Maryam Ahmadi,maryam.ahmadi@example.com
A walk through the forest trails.,"forest, trail",Forest Walk,nature,P005,Reza Jafari,reza.jafari@example.com
The magnificence of city skylines.,"city, skyline",Skyline Views,urban,P003,Hossein Karimi,hossein.karimi@example.com
Experiencing the magic of winter wonderland.,"winter, snow",Winter Magic,seasonal,P006,Fatemeh Ebrahimi,fatemeh.ebrahimi@example.com
The beauty of autumn leaves.,"autumn, leaves",Autumn Beauty,seasonal,P007,Mahdi Ghasemi,mahdi.ghasemi@example.com
